{
  "name": "Sample name",
  "description": "sample-description",
  "packageFileName": "Sample packageFileName",
  "adminConsoleSettingsFileName": "Sample adminConsoleSettingsFileName",
  "customizationFileName": "Sample customizationFileName",
  "pluginsFileName": "Sample pluginsFileName",
  "dataSource": "sample-dataSource",
  "databaseScripts": []
}